{
  "approval_requirement": {
    "required": true,
    "responsible_role": "responsible-operator",
    "trusted_channels": [
      "operator_console"
    ]
  },
  "bindings": {
    "command_set_sha256": "73e55a60dba2c96767f120f046427647c0c8cb78cdef9ab981974643defbdc25",
    "policy_bundle_sha256": "5cdcdd72508f5bb886be37ad1a5754dc2a117b5ac64baaec99c2c6b45c2ad4ac",
    "runtime_sha256": "77be1538738850de8926874a1142b68f3055f35e2a7820d3f176d5905f16c775",
    "schema_bundle_sha256": "effe68dc6c101df2b9abf1ef4b87e30b5e5ab1c74921f2b879cd7a333460d3a2"
  },
  "commands": [
    {
      "action_id": "launch",
      "argv": [
        "/bin/bash",
        "/home/kojiek/gpu_queue/p2/pending/128_metric_invariance_calibration_quiet_r2.sh"
      ],
      "environment": {
        "CUDA_VISIBLE_DEVICES": "0",
        "PYTHONUNBUFFERED": "1"
      },
      "working_directory": "/home/kojiek/MeanAudio"
    },
    {
      "action_id": "resume",
      "argv": [
        "/bin/bash",
        "/home/kojiek/gpu_queue/p2/pending/128_metric_invariance_calibration_quiet_r2.sh"
      ],
      "environment": {
        "CUDA_VISIBLE_DEVICES": "0",
        "PYTHONUNBUFFERED": "1"
      },
      "working_directory": "/home/kojiek/MeanAudio"
    },
    {
      "action_id": "preflight",
      "argv": [
        "/home/kojiek/venvs/dac/bin/python",
        "/home/kojiek/MeanAudio/scripts/eval/metric_invariance_128.py",
        "--preflight"
      ],
      "environment": {
        "CUDA_VISIBLE_DEVICES": "0",
        "PYTHONUNBUFFERED": "1"
      },
      "working_directory": "/home/kojiek/MeanAudio"
    },
    {
      "action_id": "postflight",
      "argv": [
        "/home/kojiek/venvs/dac/bin/python",
        "/home/kojiek/MeanAudio/scripts/eval/metric_invariance_128.py",
        "--validate-only"
      ],
      "environment": {
        "CUDA_VISIBLE_DEVICES": "0",
        "PYTHONUNBUFFERED": "1"
      },
      "working_directory": "/home/kojiek/MeanAudio"
    }
  ],
  "corpus": {
    "kind": "non_generated",
    "source_artifacts": [
      {
        "path": "/home/kojiek/MeanAudio/docs/experiments/metric_invariance_128a_20261017_quiet_r2_contract.json",
        "sha256": "4c39f16ccfe48c0c1e65fbf429bcf2f4a1e0f48f19c32ca0770f382342722473"
      },
      {
        "path": "/mnt/seagate/kojiek_data/metric_invariance_128_20261017/inputs.json",
        "sha256": "6b67e84c359924e7c30add5acc710c190281f1812f96c758fde50bfb6f7155b1"
      },
      {
        "path": "/home/kojiek/MeanAudio/docs/experiments/harn/metric_invariance_128_quiet_r2/operator_request.txt",
        "sha256": "4785efb5c7aae72c77bf7cb6d33541d17f5fa67309015d9afcdfcc75ea8890be"
      },
      {
        "path": "/home/kojiek/MeanAudio/docs/experiments/harn/metric_invariance_128_quiet_r2/acceptance.json",
        "sha256": "79818cb680b053f6a250693644b98539c737397ee42cbb6a98a5bc2597d2d986"
      }
    ]
  },
  "document_kind": "experiment_contract",
  "experiment_id": "metric-invariance-128a-20261017_quiet_r2",
  "filesystems": [
    {
      "hard_floor_bytes": 53687091200,
      "path": "/mnt/seagate/kojiek_data/metric_invariance_128_20261017_quiet_r2/a",
      "peak_additional_bytes": 2147483648,
      "recovery_reserve_bytes": 2147483648,
      "transient_bytes": 536870912,
      "warning_floor_bytes": 85899345920
    },
    {
      "hard_floor_bytes": 53687091200,
      "path": "/home/kojiek/MeanAudio",
      "peak_additional_bytes": 6442450944,
      "recovery_reserve_bytes": 2147483648,
      "transient_bytes": 104857600,
      "warning_floor_bytes": 64424509440
    }
  ],
  "notification_events": [
    "queue_handoff",
    "start",
    "preflight_pass",
    "smoke_pass",
    "calibration_gate",
    "success",
    "failure",
    "held",
    "interrupted",
    "paused",
    "preflight_invalid",
    "postflight_invalid",
    "disk_hard_stop",
    "disk_warning",
    "storage_recovered",
    "stall",
    "smoke_budget_invalid",
    "budget_deferred",
    "controller_incident"
  ],
  "phases": [
    {
      "action_id": "launch",
      "completion_evidence": [
        {
          "path": "/home/kojiek/MeanAudio/scripts/eval/metric_invariance_128.py",
          "sha256": "cc94d06706f86c6696758dbc53938e6f8b8570a0453c3917502cd54947b34a87"
        }
      ],
      "input_artifacts": [
        {
          "path": "/home/kojiek/MeanAudio/docs/experiments/metric_invariance_128a_20261017_quiet_r2_contract.json",
          "sha256": "4c39f16ccfe48c0c1e65fbf429bcf2f4a1e0f48f19c32ca0770f382342722473"
        },
        {
          "path": "/mnt/seagate/kojiek_data/metric_invariance_128_20261017/inputs.json",
          "sha256": "6b67e84c359924e7c30add5acc710c190281f1812f96c758fde50bfb6f7155b1"
        },
        {
          "path": "/home/kojiek/MeanAudio/docs/experiments/harn/metric_invariance_128_quiet_r2/operator_request.txt",
          "sha256": "4785efb5c7aae72c77bf7cb6d33541d17f5fa67309015d9afcdfcc75ea8890be"
        },
        {
          "path": "/home/kojiek/MeanAudio/docs/experiments/harn/metric_invariance_128_quiet_r2/acceptance.json",
          "sha256": "79818cb680b053f6a250693644b98539c737397ee42cbb6a98a5bc2597d2d986"
        }
      ],
      "output_paths": [
        "/mnt/seagate/kojiek_data/metric_invariance_128_20261017_quiet_r2/a/summary.json"
      ],
      "phase_id": "smoke-and-calibration",
      "resume_action_id": "resume"
    }
  ],
  "repair": {
    "enabled": false
  },
  "required_preflight_checks": [
    "policy",
    "provenance",
    "storage",
    "acceptance",
    "queue",
    "watcher"
  ],
  "run_id": "run-20261017-128-metric-invariance_quiet_r2",
  "schema_bundle_id": "harn-schema-v1",
  "schema_version": "1.0.0"
}
