{
  "approval_requirement": {
    "required": true,
    "responsible_role": "responsible-operator",
    "trusted_channels": [
      "operator_console"
    ]
  },
  "bindings": {
    "command_set_sha256": "22bca96de932350c23e41c54273d3a15770e803847613e41ce8035d9fb38a4d4",
    "policy_bundle_sha256": "5cdcdd72508f5bb886be37ad1a5754dc2a117b5ac64baaec99c2c6b45c2ad4ac",
    "runtime_sha256": "77be1538738850de8926874a1142b68f3055f35e2a7820d3f176d5905f16c775",
    "schema_bundle_sha256": "effe68dc6c101df2b9abf1ef4b87e30b5e5ab1c74921f2b879cd7a333460d3a2"
  },
  "commands": [
    {
      "action_id": "launch",
      "argv": [
        "/bin/bash",
        "/home/kojiek/gpu_queue/p2/pending/128_metric_invariance_calibration.sh"
      ],
      "environment": {
        "CUDA_VISIBLE_DEVICES": "0",
        "PYTHONUNBUFFERED": "1"
      },
      "working_directory": "/home/kojiek/MeanAudio"
    },
    {
      "action_id": "resume",
      "argv": [
        "/bin/bash",
        "/home/kojiek/gpu_queue/p2/pending/128_metric_invariance_calibration.sh"
      ],
      "environment": {
        "CUDA_VISIBLE_DEVICES": "0",
        "PYTHONUNBUFFERED": "1"
      },
      "working_directory": "/home/kojiek/MeanAudio"
    },
    {
      "action_id": "preflight",
      "argv": [
        "/home/kojiek/venvs/dac/bin/python",
        "/home/kojiek/MeanAudio/scripts/eval/metric_invariance_128.py",
        "--preflight"
      ],
      "environment": {
        "CUDA_VISIBLE_DEVICES": "0",
        "PYTHONUNBUFFERED": "1"
      },
      "working_directory": "/home/kojiek/MeanAudio"
    },
    {
      "action_id": "postflight",
      "argv": [
        "/home/kojiek/venvs/dac/bin/python",
        "/home/kojiek/MeanAudio/scripts/eval/metric_invariance_128.py",
        "--validate-only"
      ],
      "environment": {
        "CUDA_VISIBLE_DEVICES": "0",
        "PYTHONUNBUFFERED": "1"
      },
      "working_directory": "/home/kojiek/MeanAudio"
    }
  ],
  "corpus": {
    "kind": "non_generated",
    "source_artifacts": [
      {
        "path": "/home/kojiek/MeanAudio/docs/experiments/metric_invariance_128a_20261017_contract.json",
        "sha256": "f734c8eac8afaf46b097961bd1ca98567c0796229b41b1aaa3581ccbfccbe297"
      },
      {
        "path": "/mnt/seagate/kojiek_data/metric_invariance_128_20261017/inputs.json",
        "sha256": "6b67e84c359924e7c30add5acc710c190281f1812f96c758fde50bfb6f7155b1"
      },
      {
        "path": "/home/kojiek/MeanAudio/docs/experiments/harn/metric_invariance_128/operator_request.txt",
        "sha256": "44a1f6f736b227f58aa282d8f64794769bc372ac8282cd1f1d96942da5bb7b01"
      },
      {
        "path": "/home/kojiek/MeanAudio/docs/experiments/harn/metric_invariance_128/acceptance.json",
        "sha256": "cdc66c94fb3a66cf2dffd50b9b46250197b741246848dc0b647d2d4b2ae15b38"
      }
    ]
  },
  "document_kind": "experiment_contract",
  "experiment_id": "metric-invariance-128a-20261017",
  "filesystems": [
    {
      "hard_floor_bytes": 53687091200,
      "path": "/mnt/seagate/kojiek_data/metric_invariance_128_20261017/a",
      "peak_additional_bytes": 2147483648,
      "recovery_reserve_bytes": 2147483648,
      "transient_bytes": 536870912,
      "warning_floor_bytes": 85899345920
    },
    {
      "hard_floor_bytes": 53687091200,
      "path": "/home/kojiek/MeanAudio",
      "peak_additional_bytes": 6442450944,
      "recovery_reserve_bytes": 2147483648,
      "transient_bytes": 104857600,
      "warning_floor_bytes": 64424509440
    }
  ],
  "notification_events": [
    "queue_handoff",
    "start",
    "preflight_pass",
    "smoke_pass",
    "calibration_gate",
    "success",
    "failure",
    "held",
    "interrupted",
    "paused",
    "preflight_invalid",
    "postflight_invalid",
    "disk_hard_stop",
    "disk_warning",
    "storage_recovered",
    "stall",
    "smoke_budget_invalid",
    "budget_deferred",
    "controller_incident"
  ],
  "phases": [
    {
      "action_id": "launch",
      "completion_evidence": [
        {
          "path": "/home/kojiek/MeanAudio/scripts/eval/metric_invariance_128.py",
          "sha256": "b7cd9a91c7c2c8a4cb7582de7c2ade7951bc9f2bc7517becc59819d36831f696"
        }
      ],
      "input_artifacts": [
        {
          "path": "/home/kojiek/MeanAudio/docs/experiments/metric_invariance_128a_20261017_contract.json",
          "sha256": "f734c8eac8afaf46b097961bd1ca98567c0796229b41b1aaa3581ccbfccbe297"
        },
        {
          "path": "/mnt/seagate/kojiek_data/metric_invariance_128_20261017/inputs.json",
          "sha256": "6b67e84c359924e7c30add5acc710c190281f1812f96c758fde50bfb6f7155b1"
        },
        {
          "path": "/home/kojiek/MeanAudio/docs/experiments/harn/metric_invariance_128/operator_request.txt",
          "sha256": "44a1f6f736b227f58aa282d8f64794769bc372ac8282cd1f1d96942da5bb7b01"
        },
        {
          "path": "/home/kojiek/MeanAudio/docs/experiments/harn/metric_invariance_128/acceptance.json",
          "sha256": "cdc66c94fb3a66cf2dffd50b9b46250197b741246848dc0b647d2d4b2ae15b38"
        }
      ],
      "output_paths": [
        "/mnt/seagate/kojiek_data/metric_invariance_128_20261017/a/summary.json"
      ],
      "phase_id": "smoke-and-calibration",
      "resume_action_id": "resume"
    }
  ],
  "repair": {
    "enabled": false
  },
  "required_preflight_checks": [
    "policy",
    "provenance",
    "storage",
    "acceptance",
    "queue",
    "watcher"
  ],
  "run_id": "run-20261017-128-metric-invariance",
  "schema_bundle_id": "harn-schema-v1",
  "schema_version": "1.0.0"
}
